{
  "args": [],
  "config": {
    "ACT_BLOCKS": 256,
    "ACT_ROWS": 0,
    "D": 32,
    "DRAM_BYTES": 33554432,
    "DSTEP": false,
    "IMEM_WORDS": 65536,
    "LANES": 8,
    "MCOLS": 4,
    "PAIR": false,
    "S": 1,
    "SEQ_WC": false,
    "STREAM": false,
    "TMEM_WORDS": 65536
  },
  "instruction_counts": [
    8
  ],
  "labels": {},
  "metadata": {
    "case": "bonsai_rmsnorm",
    "compile_wall_seconds": 0.0005052079795859754,
    "complete_operator_shape": true,
    "data": "synthetic activations and weights",
    "full_operator_N": 2048,
    "independent_reference": "NumPy float64 operator; not end-to-end pretrained inference",
    "kind": "rmsnorm",
    "logits_address": 8192,
    "logits_count": 2048,
    "shape_M_K_N": [
      1,
      2048,
      2048
    ],
    "weight_format": "int8",
    "weight_source": null
  }
}
