{
  "args": [],
  "config": {
    "ACT_BLOCKS": 64,
    "ACT_ROWS": 0,
    "D": 128,
    "DRAM_BYTES": 33554432,
    "DSTEP": true,
    "IMEM_WORDS": 65536,
    "LANES": 8,
    "MCOLS": 4,
    "PAIR": false,
    "S": 1,
    "SEQ_WC": true,
    "STREAM": false,
    "TMEM_WORDS": 65536
  },
  "instruction_counts": [
    277
  ],
  "labels": {},
  "metadata": {}
}
