{
  "args": [],
  "config": {
    "ACT_BLOCKS": 64,
    "ACT_ROWS": 0,
    "D": 32,
    "DRAM_BYTES": 1048576,
    "DSTEP": false,
    "IMEM_WORDS": 65536,
    "LANES": 8,
    "MCOLS": 4,
    "PAIR": false,
    "S": 1,
    "SEQ_WC": true,
    "STREAM": false,
    "TMEM_WORDS": 8192
  },
  "instruction_counts": [
    93
  ],
  "labels": {
    "0": "input",
    "1": "input",
    "10": "decoder.layer_{iteration}",
    "11": "decoder.layer_{iteration}",
    "12": "decoder.layer_{iteration}",
    "13": "decoder.layer_{iteration}",
    "14": "decoder.layer_{iteration}",
    "15": "decoder.layer_{iteration}",
    "16": "decoder.layer_{iteration}",
    "17": "decoder.layer_{iteration}",
    "18": "decoder.layer_{iteration}",
    "19": "decoder.layer_{iteration}",
    "2": "input",
    "20": "decoder.layer_{iteration}",
    "21": "decoder.layer_{iteration}",
    "22": "decoder.layer_{iteration}",
    "23": "decoder.layer_{iteration}",
    "24": "decoder.layer_{iteration}",
    "25": "decoder.layer_{iteration}",
    "26": "decoder.layer_{iteration}",
    "27": "decoder.layer_{iteration}",
    "28": "decoder.layer_{iteration}",
    "29": "decoder.layer_{iteration}",
    "3": "input",
    "30": "decoder.layer_{iteration}",
    "31": "decoder.layer_{iteration}",
    "32": "decoder.layer_{iteration}",
    "33": "decoder.layer_{iteration}",
    "34": "decoder.layer_{iteration}",
    "35": "decoder.layer_{iteration}",
    "36": "decoder.layer_{iteration}",
    "37": "decoder.layer_{iteration}",
    "38": "decoder.layer_{iteration}",
    "39": "decoder.layer_{iteration}",
    "4": "input",
    "40": "decoder.layer_{iteration}",
    "41": "decoder.layer_{iteration}",
    "42": "decoder.layer_{iteration}",
    "43": "decoder.layer_{iteration}",
    "44": "decoder.layer_{iteration}",
    "45": "decoder.layer_{iteration}",
    "46": "decoder.layer_{iteration}",
    "47": "decoder.layer_{iteration}",
    "48": "decoder.layer_{iteration}",
    "49": "decoder.layer_{iteration}",
    "5": "decoder.layer_{iteration}",
    "50": "decoder.layer_{iteration}",
    "51": "decoder.layer_{iteration}",
    "52": "decoder.layer_{iteration}",
    "53": "decoder.layer_{iteration}",
    "54": "decoder.layer_{iteration}",
    "55": "decoder.layer_{iteration}",
    "56": "decoder.layer_{iteration}",
    "57": "decoder.layer_{iteration}",
    "58": "decoder.layer_{iteration}",
    "59": "decoder.layer_{iteration}",
    "6": "decoder.layer_{iteration}",
    "60": "decoder.layer_{iteration}",
    "61": "decoder.layer_{iteration}",
    "62": "decoder.layer_{iteration}",
    "63": "decoder.layer_{iteration}",
    "64": "decoder.layer_{iteration}",
    "65": "decoder.layer_{iteration}",
    "66": "decoder.layer_{iteration}",
    "67": "decoder.layer_{iteration}",
    "68": "decoder.layer_{iteration}",
    "69": "decoder.layer_{iteration}",
    "7": "decoder.layer_{iteration}",
    "70": "decoder.layer_{iteration}",
    "71": "decoder.layer_{iteration}",
    "72": "decoder.layer_{iteration}",
    "73": "decoder.layer_{iteration}",
    "74": "decoder.layer_{iteration}",
    "75": "decoder.layer_{iteration}",
    "76": "decoder.layer_{iteration}",
    "77": "decoder.layer_{iteration}",
    "78": "decoder.layer_{iteration}",
    "79": "decoder.layer_{iteration}",
    "8": "decoder.layer_{iteration}",
    "80": "decoder.layer_{iteration}",
    "81": "decoder.layer_{iteration}",
    "82": "decoder.layer_{iteration}",
    "83": "final_norm_head",
    "84": "final_norm_head",
    "85": "final_norm_head",
    "86": "final_norm_head",
    "87": "final_norm_head",
    "88": "final_norm_head",
    "89": "final_norm_head",
    "9": "decoder.layer_{iteration}",
    "90": "final_norm_head",
    "91": "final_norm_head",
    "92": "final_norm_head"
  },
  "metadata": {
    "case": "tiny random full Qwen3 topology",
    "host_inputs": [
      [
        0,
        256
      ],
      [
        256,
        64
      ],
      [
        384,
        64
      ]
    ],
    "logits_address": 768,
    "logits_count": 64,
    "note": "teacher-forced tokens; two serial prompt steps, then one decode step; no host/sample cost",
    "phase": "prefill",
    "position": 0,
    "seed": 20261019,
    "spec": {
      "bos": 151643,
      "ctx": 0,
      "embed": "f32",
      "eos": [
        151645,
        151643
      ],
      "eps": 1e-06,
      "ffn": 96,
      "formats": "",
      "head_dim": 32,
      "hidden": 64,
      "layers": 2,
      "mix": "",
      "n_kv": 1,
      "n_q": 2,
      "nope": [],
      "qk_norm": true,
      "qk_smooth": true,
      "rope_div": [],
      "rope_scale": 1.0,
      "rotary": 0,
      "theta": 1000000.0,
      "tied": true,
      "vocab": 64
    },
    "token": 1
  }
}
